{
  "$schema": "../schema/template-variables.schema.json",
  "templateId": "tp_lp3_clinic_slide",
  "version": 1,
  "meta": {
    "label": "クリニックLP（スライド主体）",
    "themeFile": "css/style.css",
    "htmlFile": "index.html",
    "notes": "AI/管理画面は TEMPLATE_VARIABLES.md の適用手順に従うこと。"
  },
  "apply": {
    "htmlFile": "index.html",
    "themeAttribute": "html[data-theme]",
    "controlsCssFile": "css/site-controls.css",
    "customCssFile": "css/custom.css",
    "layoutStyleTarget": "html"
  },
  "colorScheme": {
    "active": "blue",
    "options": {
      "blue": {
        "label": "ブルー",
        "tokens": {
          "--primary-color": "#4476b9",
          "--primary-inverse-color": "#fff",
          "--accent-color": "#c43311",
          "--accent-inverse-color": "#fff",
          "--light-color": "#eef3f9",
          "--light-inverse-color": "#333",
          "--secondary-color": "#30363d",
          "--secondary-inverse-color": "#fff"
        }
      },
      "skyblue": {
        "label": "スカイブルー",
        "tokens": {
          "--primary-color": "#4ba3fc",
          "--primary-inverse-color": "#fff",
          "--accent-color": "#2d7dd2",
          "--accent-inverse-color": "#fff",
          "--light-color": "#e8f4ff",
          "--light-inverse-color": "#333"
        }
      },
      "green": {
        "label": "グリーン",
        "tokens": {
          "--primary-color": "#2d8f5f",
          "--primary-inverse-color": "#fff",
          "--accent-color": "#5cb88a",
          "--accent-inverse-color": "#fff",
          "--light-color": "#eef8f2",
          "--light-inverse-color": "#333"
        }
      },
      "navy": {
        "label": "ネイビー",
        "tokens": {
          "--primary-color": "#101f3a",
          "--primary-inverse-color": "#fff",
          "--accent-color": "#7b8269",
          "--accent-inverse-color": "#fff",
          "--light-color": "#f2f5f9",
          "--light-inverse-color": "#101f3a"
        }
      },
      "pink": {
        "label": "ピンク",
        "tokens": {
          "--primary-color": "#ff9999",
          "--primary-inverse-color": "#fff",
          "--accent-color": "#ec6262",
          "--accent-inverse-color": "#fff",
          "--light-color": "#fff5f5",
          "--light-inverse-color": "#333",
          "--bg-color": "#fff",
          "--bg-inverse-color": "#333"
        }
      }
    }
  },
  "sections": [
    {
      "id": "kodawari",
      "label": "こだわり",
      "selector": "#kodawari",
      "visible": true,
      "navHrefs": [
        "#kodawari"
      ],
      "removable": true
    },
    {
      "id": "service",
      "label": "サービス",
      "selector": "#service",
      "visible": true,
      "navHrefs": [
        "#service"
      ],
      "removable": true
    },
    {
      "id": "flow",
      "label": "ご利用の流れ",
      "selector": "#flow",
      "visible": true,
      "navHrefs": [
        "#flow"
      ],
      "removable": true
    },
    {
      "id": "voice",
      "label": "お客様の声",
      "selector": "#voice",
      "visible": true,
      "navHrefs": [
        "#voice"
      ],
      "removable": true
    },
    {
      "id": "faq",
      "label": "よくある質問",
      "selector": "#faq",
      "visible": true,
      "navHrefs": [
        "#faq"
      ],
      "removable": true
    }
  ],
  "layout": {
    "serviceColumns": {
      "label": "サービス紹介のカラム数",
      "value": 3,
      "cssVar": "--layout-service-columns",
      "min": 1,
      "max": 4,
      "appliesTo": "service grid"
    },
    "contentSpace": {
      "label": "左右余白",
      "value": "4rem",
      "cssVar": "--content-space",
      "appliesTo": ":root --content-space"
    }
  },
  "customCss": {
    "file": "css/custom.css",
    "content": "",
    "description": "管理画面から注入する追加CSS。このファイル内容を丸ごと置換する。"
  },
  "contentSlots": [
    {
      "id": "title",
      "label": "ページタイトル",
      "selector": "title",
      "type": "text"
    }
  ],
  "imageSlots": [
    {
      "id": "logo",
      "label": "ロゴ",
      "path": "images/logo.png",
      "selector": "img[src*='logo']"
    }
  ]
}
